Review|Title|Content
Review 1|Erfrischend und lecker|"Echt lecker und erfrischend, trotz leichtem Molke Nachgeschmack,
werde ich sicherlich wieder bestellen und auch mal die anderen Geschmacksorten ausprobieren"
Review 2|Genial|Wir mein Cola Zero/Schwibschwab Zero bedarf ersetzen und dazu Proteine rein ballern
Review 3|👍|Ein tolles Isoclear
Review 4|👍|Leckeres Isoclear das einfach klasse in der Zubereitung ist.
Review 5|One Apple a day keeps the doctor away 😀|Leckerer etwas schön saurer Geschmack.
Review 6|Good to go|"Guter Geschmack.
Gute Größe zum mitnehmen und z.B. auf der Arbeit zu machen."
Review 7|Ganz okay.|Schon okay, aber es gibt bessere Sorten wie Icy Pear.
Review 8|Pfirsich|Sehr gut
Review 9|Schmecklisch|1A
Review 10|Best clear whey ever|Love this! I struggle with normal whey protein so finding a decent tasting clear whey is super important for me. This tastes so amazing, not artificial at all and mixes so well. The best clear whey I've ever had.
Review 11|lekker|verfrissend
Review 12|Prima clear whey drankje|"Heerlijk drankje en goed van smaak! 
Enige nadeel is het klonteren maar dat schijnt normaal te zijn ! Lost vrij snel op."
Review 13|Famos|Passt sehr gut!
Review 14|Nostalgiegeschmack|Ich mag, dass der Green Apple Geschmack sehr aufdringlich und sogar ein bisschen saurer ist! Eignet sich super als Limo, der leicht chemische Geschmack ist da voll mein Ding.
Review 15|Perfekt :)|Ich finde den Geschmack dieses Pulvers sehr angenehm und nicht so aufdringlich! Genau das habe ich gesucht für ein bisschen Abwechslung zum Apfel Geschmack :D
Review 16|Gerne nochmal - oder auch noch nen 3tes Mal...|"Ich bin sehr zufrieden mit dem Produkt.

Das Whey löst sich super auf und der Geschmack erinnert sehr stark an den instant Eistee, den man ausm Supermarkt kennt - was ich sehr positiv finde.
Ansonsten ist es momentan mein Standard-Whey nachm Training und ich habe es direkt auch nochmal nachgeordert."
Review 17|Super! - Gute Zucker-Eistee-Alternative!|Schmeckt unglaublich gut! Für alle, die sonst gerne Zuckerhaltige Getränke in zu großen Mengen zu sich nehmen dürfte es eine gute Alternative sein.
Review 18|Exotisch gut|"Erfrischend und lecker.
Für meinen Geschmack etwas zu süß."
Review 19|Bester Geschmack|Einfach lecker und geil. Top !!!!!!
Review 20|Erfrischend lecker|Nicht so süß wie andere und daher besser gegen Durst.. Grapefruit Geschmack ist sehr natürlich.. 👍
